{
  "schema_version": 1,
  "catalog_id": "nosey-built-in",
  "provenance": "Draft, authored from supplied mappings.json plus new derived signals on 2026-10-28; locally fixture-tested; not production-repository validated; mapping_status updated for 20 technologies given explicit skill references, signals unchanged",
  "policy": {
    "case_sensitive_package_names": true,
    "py_package_normalization": "PEP503",
    "scan_scope": "eligible packages and repository root",
    "source_code_execution": false,
    "no_symlinks": true,
    "content_max_bytes": 65536,
    "mcp_only_enabled": true,
    "evidence": "positive signal with project-relative file; no confidence percent"
  },
  "rules": [
    {
      "technology_id": "anthropic-sdk",
      "mapping_status": "mapped",
      "origin": "documented_examples_plus_derived_supplements",
      "logic": "any",
      "signals": [
        {
          "type": "dependency",
          "ecosystem": "npm",
          "name": "@anthropic-ai/sdk"
        },
        {
          "type": "dependency",
          "ecosystem": "py",
          "name": "anthropic"
        }
      ]
    },
    {
      "technology_id": "chrome-devtools-mcp",
      "mapping_status": "detect_only",
      "origin": "derived_and_review_required",
      "logic": "any",
      "signals": [
        {
          "type": "mcp_package",
          "name": "chrome-devtools-mcp"
        },
        {
          "type": "mcp_package",
          "name": "@anthropic-ai/chrome-devtools-mcp"
        }
      ]
    },
    {
      "technology_id": "cloudflare-agents",
      "mapping_status": "mapped",
      "origin": "documented_examples_plus_derived_supplements",
      "logic": "any",
      "signals": [
        {
          "type": "dependency",
          "ecosystem": "npm",
          "name": "agents"
        }
      ]
    },
    {
      "technology_id": "cloudflare-ai",
      "mapping_status": "mapped",
      "origin": "documented_examples_plus_derived_supplements",
      "logic": "any",
      "signals": [
        {
          "type": "dependency",
          "ecosystem": "npm",
          "name": "@cloudflare/ai"
        }
      ]
    },
    {
      "technology_id": "context7-mcp",
      "mapping_status": "detect_only",
      "origin": "derived_and_review_required",
      "logic": "any",
      "signals": [
        {
          "type": "mcp_package",
          "name": "@upstash/context7-mcp"
        },
        {
          "type": "mcp_package",
          "name": "context7-mcp"
        }
      ]
    },
    {
      "technology_id": "firecrawl",
      "mapping_status": "mapped",
      "origin": "documented_examples_plus_derived_supplements",
      "logic": "any",
      "signals": [
        {
          "type": "dependency",
          "ecosystem": "npm",
          "name": "@mendable/firecrawl-js"
        },
        {
          "type": "dependency",
          "ecosystem": "py",
          "name": "firecrawl-py"
        }
      ]
    },
    {
      "technology_id": "google-genai",
      "mapping_status": "mapped",
      "origin": "documented_examples_plus_derived_supplements",
      "logic": "any",
      "signals": [
        {
          "type": "dependency",
          "ecosystem": "npm",
          "name": "@google/genai"
        },
        {
          "type": "dependency",
          "ecosystem": "py",
          "name": "google-genai"
        }
      ]
    },
    {
      "technology_id": "hugging-face",
      "mapping_status": "mapped",
      "origin": "derived_and_review_required",
      "logic": "any",
      "signals": [
        {
          "type": "dependency",
          "ecosystem": "py",
          "name": "huggingface-hub"
        },
        {
          "type": "dependency",
          "ecosystem": "py",
          "name": "transformers"
        },
        {
          "type": "dependency",
          "ecosystem": "py",
          "name": "datasets"
        },
        {
          "type": "dependency",
          "ecosystem": "npm",
          "name": "@huggingface/inference"
        },
        {
          "type": "dependency",
          "ecosystem": "npm",
          "name": "@huggingface/transformers"
        }
      ]
    },
    {
      "technology_id": "langchain",
      "mapping_status": "mapped",
      "origin": "documented_examples_plus_derived_supplements",
      "logic": "any",
      "signals": [
        {
          "type": "dependency",
          "ecosystem": "npm",
          "name": "langchain"
        },
        {
          "type": "dependency",
          "ecosystem": "py",
          "name": "langchain"
        },
        {
          "type": "dependency",
          "ecosystem": "py",
          "name": "langchain-core"
        },
        {
          "type": "dependency",
          "ecosystem": "py",
          "name": "langchain-openai"
        },
        {
          "type": "dependency",
          "ecosystem": "npm",
          "name": "@langchain/core"
        },
        {
          "type": "dependency",
          "ecosystem": "npm",
          "name": "@langchain/openai"
        }
      ]
    },
    {
      "technology_id": "langfuse",
      "mapping_status": "mapped",
      "origin": "documented_examples_plus_derived_supplements",
      "logic": "any",
      "signals": [
        {
          "type": "dependency",
          "ecosystem": "npm",
          "name": "langfuse"
        },
        {
          "type": "dependency",
          "ecosystem": "npm",
          "name": "@langfuse/tracing"
        },
        {
          "type": "dependency",
          "ecosystem": "py",
          "name": "langfuse"
        }
      ]
    },
    {
      "technology_id": "langgraph",
      "mapping_status": "mapped",
      "origin": "documented_examples_plus_derived_supplements",
      "logic": "any",
      "signals": [
        {
          "type": "dependency",
          "ecosystem": "npm",
          "name": "@langchain/langgraph"
        },
        {
          "type": "dependency",
          "ecosystem": "py",
          "name": "langgraph"
        }
      ]
    },
    {
      "technology_id": "litellm",
      "mapping_status": "detect_only",
      "origin": "derived_and_review_required",
      "logic": "any",
      "signals": [
        {
          "type": "dependency",
          "ecosystem": "py",
          "name": "litellm"
        },
        {
          "type": "dependency",
          "ecosystem": "npm",
          "name": "litellm"
        }
      ]
    },
    {
      "technology_id": "llamaindex",
      "mapping_status": "detect_only",
      "origin": "derived_and_review_required",
      "logic": "any",
      "signals": [
        {
          "type": "dependency",
          "ecosystem": "py",
          "name": "llama-index"
        },
        {
          "type": "dependency",
          "ecosystem": "py",
          "name": "llama-index-core"
        },
        {
          "type": "dependency",
          "ecosystem": "npm",
          "name": "llamaindex"
        }
      ]
    },
    {
      "technology_id": "mastra",
      "mapping_status": "mapped",
      "origin": "documented_examples_plus_derived_supplements",
      "logic": "any",
      "signals": [
        {
          "type": "dependency",
          "ecosystem": "npm",
          "name": "@mastra/core"
        }
      ]
    },
    {
      "technology_id": "mcp-sdk",
      "mapping_status": "mapped",
      "origin": "documented_examples_plus_derived_supplements",
      "logic": "any",
      "signals": [
        {
          "type": "dependency",
          "ecosystem": "npm",
          "name": "@modelcontextprotocol/sdk"
        },
        {
          "type": "dependency",
          "ecosystem": "py",
          "name": "mcp"
        }
      ]
    },
    {
      "technology_id": "openai-agents-sdk",
      "mapping_status": "detect_only",
      "origin": "derived_and_review_required",
      "logic": "any",
      "signals": [
        {
          "type": "dependency",
          "ecosystem": "py",
          "name": "openai-agents"
        },
        {
          "type": "dependency",
          "ecosystem": "npm",
          "name": "@openai/agents"
        },
        {
          "type": "dependency",
          "ecosystem": "npm",
          "name": "@openai/agents-core"
        }
      ]
    },
    {
      "technology_id": "openai-docs-mcp",
      "mapping_status": "detect_only",
      "origin": "derived_and_review_required",
      "logic": "any",
      "signals": [
        {
          "type": "mcp_package",
          "name": "@openai/docs-mcp"
        },
        {
          "type": "mcp_package",
          "name": "openai-docs-mcp"
        }
      ]
    },
    {
      "technology_id": "openai-sdk",
      "mapping_status": "detect_only",
      "origin": "derived_and_review_required",
      "logic": "any",
      "signals": [
        {
          "type": "dependency",
          "ecosystem": "py",
          "name": "openai"
        },
        {
          "type": "dependency",
          "ecosystem": "npm",
          "name": "openai"
        }
      ]
    },
    {
      "technology_id": "opentelemetry",
      "mapping_status": "mapped",
      "origin": "documented_examples_plus_derived_supplements",
      "logic": "any",
      "signals": [
        {
          "type": "dependency",
          "ecosystem": "npm",
          "name": "@opentelemetry/api"
        },
        {
          "type": "dependency",
          "ecosystem": "npm",
          "name": "@opentelemetry/sdk-node"
        },
        {
          "type": "dependency",
          "ecosystem": "npm",
          "name": "@opentelemetry/sdk-trace-node"
        },
        {
          "type": "dependency",
          "ecosystem": "py",
          "name": "opentelemetry-api"
        },
        {
          "type": "dependency",
          "ecosystem": "py",
          "name": "opentelemetry-sdk"
        }
      ]
    },
    {
      "technology_id": "mcp-playwright",
      "mapping_status": "mapped",
      "origin": "documented_examples_plus_derived_supplements",